### ISSUE TITLE
iOS Flutter client fails to connect over QUIC when server sends QUIC Retry

### ISSUE THREAD

**Issue by fraggdiller** [TrustTunnel/TrustTunnelFlutterClient#30]
---

### TL;DR

iOS Flutter client fails to connect over QUIC when the server sends a **QUIC Retry**.
If Retry is disabled on the server, the iOS client connects successfully over HTTP/3.
This points to incorrect handling of QUIC Retry during the handshake in the iOS PacketTunnel implementation.

---

### Note

Detailed description below based on my investigation and notes, but the issue itself is real and reproducible as described above

---

## Description

When using the TrustTunnel Flutter client on **iOS** with `upstream_protocol = "http3"`, the connection fails during QUIC handshake if the server responds with a **QUIC Retry** packet.

If QUIC Retry is disabled on the server side, the iOS client connects successfully over QUIC.

This strongly suggests that QUIC Retry is not handled correctly in the iOS Flutter client / PacketTunnel implementation.

---

## Environment

* Client: TrustTunnel Flutter Client (iOS)
* Connection protocol: QUIC / HTTP3
* Server: TrustTunnel endpoint (default configuration with QUIC enabled)
* Certificate: valid public CA (not self-signed)

---

## Steps to reproduce

1. Configure TrustTunnel endpoint with QUIC enabled (default behavior).
2. Configure TrustTunnel Flutter client on iOS with:

   ```toml
   upstream_protocol = "http3"
   upstream_fallback_protocol = ""
   ```
3. Start the VPN connection from the iOS app.
4. Observe that the connection **fails** during startup.

---

## Observed behavior

* The VPN fails to connect on iOS when the server sends a QUIC Retry.
* Packet capture on the client side shows the following sequence:

  * QUIC Initial (token length = 0)
  * Server responds with QUIC Retry (token present)
  * Client attempts to restart handshake
  * VPN tunnel is terminated before handshake completes

---

## Expected behavior

* The iOS client should correctly handle QUIC Retry:

  * Retry should not be treated as a fatal connection failure
  * The handshake should continue using the provided token
  * The tunnel should reach a connected state

---

## Additional observations

* When QUIC Retry is **disabled on the server**, the iOS client connects successfully over QUIC.
* This indicates the issue is not related to certificates or server configuration in general, but specifically to Retry handling on the client side.

---

## Notes

* This issue affects the **Flutter iOS client** (NetworkExtension / PacketTunnel).
* CLI clients are not affected and are not part of this report.

---

## Possible cause (hypothesis)

The iOS PacketTunnel implementation appears to treat a temporary `disconnected` state during QUIC handshake (triggered by Retry) as a fatal error and stops the VPN client prematurely.

---

## Logs / captures

* Client-side packet capture confirms that the server sends QUIC Retry packets.
* After Retry, the tunnel is torn down before the handshake completes.

---

## Packet capture (client side)

The following tcpdump was captured on the iOS/macOS side during connection attempts.
Each QUIC Initial sent by the client is answered by a QUIC Retry from the server.
The client repeatedly restarts the handshake, but the tunnel is torn down before
the handshake completes successfully.

Command used:

sudo tcpdump -ni rvi0 -s 0 'host [MASKED] and udp port 443'

```
04:47:37.131360 IP [CLIENT].54934 > [SERVER].443: quic, initial, dcid 6704252252efe608a5c80abbcac44bf1, scid 1d410901e44e5ae6bb9ff4173fadb2b9, length 577
04:47:37.179402 IP [SERVER].443 > [CLIENT].54934: quic, retry, dcid 1d410901e44e5ae6bb9ff4173fadb2b9, scid 1b6939c610fc8e816a603d452601847e57a8e9c7, token 3f09a97e42ab46e579dbb30b381e5bf46dfc5a97069e6704252252efe608a5c80abbcac44bf1
04:47:37.182096 IP [CLIENT].55757 > [SERVER].443: quic, initial, dcid edd8163f23d874db47ebc4cd32df40e0, scid da151a3c83f7fa766d787830cf2d1dea, length 513
04:47:37.226858 IP [SERVER].443 > [CLIENT].55757: quic, retry, dcid da151a3c83f7fa766d787830cf2d1dea, scid fe67a9aebc56ec3e436dac8df603636e8db84749, token 3f09a97e42ab46e579dbb30b381e5bf46dfc5a97069fedd8163f23d874db47ebc4cd32df40e0
04:47:37.228598 IP [CLIENT].52696 > [SERVER].443: quic, initial, dcid 29584d9f61494d5d1eb24aaa1dd82234, scid a4eae0a0923793c15443458082f71632, length 481
04:47:37.273066 IP [SERVER].443 > [CLIENT].52696: quic, retry, dcid a4eae0a0923793c15443458082f71632, scid b7362d74fc07e1c5a4536f8b6b7a271cbc482006, token 3f09a97e42ab46e579dbb30b381e5bf46dfc5a9706a029584d9f61494d5d1eb24aaa1dd82234
04:47:37.275492 IP [CLIENT].49799 > [SERVER].443: quic, initial, dcid 1c0689d99186bc11eec3ec8537d6f7ae, scid 35e5ec959373973238201d03a66be99a, length 577
04:47:37.319788 IP [SERVER].443 > [CLIENT].49799: quic, retry, dcid 35e5ec959373973238201d03a66be99a, scid 4b8e6419471aa4646d1c11e1a8e907936851b0e0, token 3f09a97e42ab46e579dbb30b381e5bf46dfc5a9706a11c0689d99186bc11eec3ec8537d6f7ae
04:47:37.321903 IP [CLIENT].56193 > [SERVER].443: quic, initial, dcid d568c5d808ef4a5397ca4a26802814c4, scid ee40e1e25603269891db2ea580b3afab, length 577
04:47:37.366601 IP [SERVER].443 > [CLIENT].56193: quic, retry, dcid ee40e1e25603269891db2ea580b3afab, scid ed04af7365278b1fc0d339c9e0ca1e9226403eb5, token 3f09a97e42ab46e579dbb30b381e5bf46dfc5a9706a2d568c5d808ef4a5397ca4a26802814c4
04:47:37.370145 IP [CLIENT].64893 > [SERVER].443: quic, initial, dcid 8e0dff3ded6142666690d50a2528110d, scid 630907c7d006b136b112c23ef3edc175, length 545
04:47:37.415160 IP [SERVER].443 > [CLIENT].64893: quic, retry, dcid 630907c7d006b136b112c23ef3edc175, scid eff8343e9b7231ba714e2a7e7488d4d8fe8461f2, token 3f09a97e42ab46e579dbb30b381e5bf46dfc5a9706a38e0dff3ded6142666690d50a2528110d
04:47:37.417058 IP [CLIENT].61224 > [SERVER].443: quic, initial, dcid 666a5c8b1f27ac7138f4260174fe945a, scid 67f19ef3df5104b4264fa8d56c89d953, length 577
04:47:37.461190 IP [SERVER].443 > [CLIENT].61224: quic, retry, dcid 67f19ef3df5104b4264fa8d56c89d953, scid a1dd8bdee8c327b9544924d1f5c41bd0a279fafc, token 3f09a97e42ab46e579dbb30b381e5bf46dfc5a9706a4666a5c8b1f27ac7138f4260174fe945a
04:47:37.464623 IP [CLIENT].65262 > [SERVER].443: quic, initial, dcid 8f0e21338751c7848606282ad8b6eed5, scid 2c9a46a14e0ff56c594253cf103e84a8, length 481
04:47:37.509905 IP [SERVER].443 > [CLIENT].65262: quic, retry, dcid 2c9a46a14e0ff56c594253cf103e84a8, scid 0fd457fcbcccc9c7c0ebdd2c5f8aa1f5f4df591a, token 3f09a97e42ab46e579dbb30b381e5bf46dfc5a9706a58f0e21338751c7848606282ad8b6eed5
04:47:37.511739 IP [CLIENT].61861 > [SERVER].443: quic, initial, dcid 8740527a35ea89e6db16f780d663feb0, scid 34d350476328983ad1fb7f04516f4c9c, length 513
04:47:37.555615 IP [SERVER].443 > [CLIENT].61861: quic, retry, dcid 34d350476328983ad1fb7f04516f4c9c, scid 61ab7b7bd1b7756b0779c4702ac418df2a825661, token 3f09a97e42ab46e579dbb30b381e5bf46dfc5a9706a68740527a35ea89e6db16f780d663feb0
04:47:37.558456 IP [CLIENT].55371 > [SERVER].443: quic, initial, dcid 25743f8bdfb93d8ff59aba8e4458aaea, scid 43e97eef6db124382cbac8fc89e38e48, length 577

```

---
